[
  {
    "id": "oc_river_md_round",
    "name": "River Mass Driver Round",
    "mass": 0.05,
    "cost": 2,
    "damage_packets": {
      "kinetic": 18
    }
  },
  {
    "id": "oc_river_md_heavy_round",
    "name": "River Heavy Sabot",
    "mass": 0.08,
    "cost": 4,
    "damage_packets": {
      "kinetic": 32,
      "concussive": 8
    }
  },
  {
    "id": "prv_plasma_cell",
    "name": "Ionique Plasma Cell",
    "mass": 0.15,
    "cost": 12,
    "damage_packets": {
      "energy": 20,
      "concussive": 8
    }
  },
  {
    "id": "go_scatter_shell",
    "name": "Brutus Scatter Shell",
    "mass": 0.4,
    "cost": 18,
    "damage_packets": {
      "kinetic": 18,
      "concussive": 22
    }
  },
  {
    "id": "ora_rocket_he",
    "name": "Bellatrix HE Rocket",
    "mass": 1.0,
    "cost": 65,
    "damage_packets": {
      "kinetic": 20,
      "concussive": 30
    }
  },
  {
    "id": "go_rocket_emp",
    "name": "Disruptor EMP Rocket",
    "mass": 1.0,
    "cost": 95,
    "damage_packets": {
      "cyber": 32
    }
  },
  {
    "id": "ora_missile_light",
    "name": "Bellatrix Light Missile",
    "mass": 1.2,
    "cost": 85,
    "damage_packets": {
      "kinetic": 25,
      "concussive": 35
    }
  }
]
